00:24:27.414311 IP csce-X101CH.local.59660 > 130.104.228.140.http: Flags [S], seq 1468999752, win 29200, options [mss 1460,sackOK,TS val 2900683231 ecr 0,nop,wscale 7,mptcp capable {0xe5d57c6845bb9907}], length 0
00:24:27.560656 IP 130.104.228.140.http > csce-X101CH.local.59660: Flags [S.], seq 1604885835, ack 1468999753, win 28560, options [mss 1460,sackOK,TS val 1810216664 ecr 2900683231,nop,wscale 7,mptcp capable csum {0x1763e881bacf2481}], length 0
00:24:27.560967 IP csce-X101CH.local.59660 > 130.104.228.140.http: Flags [.], ack 1, win 229, options [nop,nop,TS val 2900683378 ecr 1810216664,mptcp capable csum {0xe5d57c6845bb9907,0x1763e881bacf2481},mptcp dss ack 3823533546], length 0
00:24:27.561088 IP csce-X101CH.local.59660 > 130.104.228.140.http: Flags [.], ack 1, win 229, options [nop,nop,TS val 2900683378 ecr 1810216664,mptcp add-addr id 2 csce-X101CH.local,mptcp dss ack 3823533546], length 0
00:24:27.561464 IP csce-X101CH.local.59660 > 130.104.228.140.http: Flags [P.], seq 1:178, ack 1, win 229, options [nop,nop,TS val 2900683378 ecr 1810216664,mptcp dss ack 3823533546 seq 4016585003 subseq 1 len 177 csum 0xc35a], length 177: HTTP: GET /snapshots/mptcp_2016_04_18.tar.gz HTTP/1.1
00:24:27.723090 IP 130.104.228.140.http > csce-X101CH.local.59660: Flags [.], ack 1, win 224, options [nop,nop,TS val 1810216817 ecr 2900683378,mptcp add-addr id 8 2001:6a8:308f:8:0:82ff:fe68:e48c,mptcp dss ack 4016585003], length 0
00:24:27.723207 IP 130.104.228.140.http > csce-X101CH.local.59660: Flags [.], ack 178, win 232, options [nop,nop,TS val 1810216817 ecr 2900683378,mptcp dss ack 4016585180], length 0
00:24:27.723363 IP 130.104.228.140.http > csce-X101CH.local.59660: Flags [.], seq 1:1429, ack 178, win 232, options [nop,nop,TS val 1810216818 ecr 2900683378,mptcp dss ack 4016585180 seq 3823533546 subseq 1 len 1428 csum 0xe796], length 1428: HTTP: HTTP/1.1 200 OK
00:24:27.723497 IP csce-X101CH.local.59660 > 130.104.228.140.http: Flags [.], ack 1429, win 251, options [nop,nop,TS val 2900683540 ecr 1810216818,mptcp dss ack 3823534974], length 0
00:24:27.723645 IP 130.104.228.140.http > csce-X101CH.local.59660: Flags [.], seq 1429:2857, ack 178, win 232, options [nop,nop,TS val 1810216818 ecr 2900683378,mptcp dss ack 4016585180 seq 3823534974 subseq 1429 len 1428 csum 0x6f74], length 1428: HTTP
00:24:27.723784 IP csce-X101CH.local.59660 > 130.104.228.140.http: Flags [.], ack 2857, win 274, options [nop,nop,TS val 2900683541 ecr 1810216818,mptcp dss ack 3823536402], length 0
00:24:27.723944 IP 130.104.228.140.http > csce-X101CH.local.59660: Flags [.], seq 2857:4285, ack 178, win 232, options [nop,nop,TS val 1810216818 ecr 2900683378,mptcp dss ack 4016585180 seq 3823536402 subseq 2857 len 1428 csum 0x88e0], length 1428: HTTP
00:24:27.724077 IP csce-X101CH.local.59660 > 130.104.228.140.http: Flags [.], ack 4285, win 297, options [nop,nop,TS val 2900683541 ecr 1810216818,mptcp dss ack 3823537830], length 0
00:24:27.724217 IP 130.104.228.140.http > csce-X101CH.local.59660: Flags [.], seq 4285:5713, ack 178, win 232, options [nop,nop,TS val 1810216818 ecr 2900683378,mptcp dss ack 4016585180 seq 3823537830 subseq 4285 len 1428 csum 0xffc0], length 1428: HTTP
00:24:27.724353 IP csce-X101CH.local.59660 > 130.104.228.140.http: Flags [.], ack 5713, win 320, options [nop,nop,TS val 2900683541 ecr 1810216818,mptcp dss ack 3823539258], length 0
00:24:27.724478 IP 130.104.228.140.http > csce-X101CH.local.59660: Flags [.], seq 5713:7141, ack 178, win 232, options [nop,nop,TS val 1810216818 ecr 2900683378,mptcp dss ack 4016585180 seq 3823539258 subseq 5713 len 1428 csum 0xc0d5], length 1428: HTTP
00:24:27.724609 IP csce-X101CH.local.59660 > 130.104.228.140.http: Flags [.], ack 7141, win 343, options [nop,nop,TS val 2900683542 ecr 1810216818,mptcp dss ack 3823540686], length 0
00:24:27.724701 IP 130.104.228.140.http > csce-X101CH.local.59660: Flags [.], seq 7141:8569, ack 178, win 232, options [nop,nop,TS val 1810216818 ecr 2900683378,mptcp dss ack 4016585180 seq 3823540686 subseq 7141 len 1428 csum 0x9191], length 1428: HTTP
00:24:27.724771 IP csce-X101CH.local.59660 > 130.104.228.140.http: Flags [.], ack 8569, win 365, options [nop,nop,TS val 2900683542 ecr 1810216818,mptcp dss ack 3823542114], length 0
00:24:27.724823 IP 130.104.228.140.http > csce-X101CH.local.59660: Flags [.], seq 8569:9997, ack 178, win 232, options [nop,nop,TS val 1810216818 ecr 2900683378,mptcp dss ack 4016585180 seq 3823542114 subseq 8569 len 1428 csum 0x3a66], length 1428: HTTP
00:24:27.724882 IP csce-X101CH.local.59660 > 130.104.228.140.http: Flags [.], ack 9997, win 388, options [nop,nop,TS val 2900683542 ecr 1810216818,mptcp dss ack 3823543542], length 0
00:24:27.724940 IP 130.104.228.140.http > csce-X101CH.local.59660: Flags [.], seq 9997:11425, ack 178, win 232, options [nop,nop,TS val 1810216818 ecr 2900683378,mptcp dss ack 4016585180 seq 3823543542 subseq 9997 len 1428 csum 0xebdf], length 1428: HTTP
00:24:27.725003 IP csce-X101CH.local.59660 > 130.104.228.140.http: Flags [.], ack 11425, win 411, options [nop,nop,TS val 2900683542 ecr 1810216818,mptcp dss ack 3823544970], length 0
00:24:27.725061 IP 130.104.228.140.http > csce-X101CH.local.59660: Flags [.], seq 11425:12853, ack 178, win 232, options [nop,nop,TS val 1810216819 ecr 2900683378,mptcp dss ack 4016585180 seq 3823544970 subseq 11425 len 1428 csum 0x493f], length 1428: HTTP
00:24:27.725124 IP csce-X101CH.local.59660 > 130.104.228.140.http: Flags [.], ack 12853, win 434, options [nop,nop,TS val 2900683542 ecr 1810216819,mptcp dss ack 3823546398], length 0
00:24:27.725181 IP 130.104.228.140.http > csce-X101CH.local.59660: Flags [.], seq 12853:14281, ack 178, win 232, options [nop,nop,TS val 1810216819 ecr 2900683378,mptcp dss ack 4016585180 seq 3823546398 subseq 12853 len 1428 csum 0xb42a], length 1428: HTTP
00:24:27.725243 IP csce-X101CH.local.59660 > 130.104.228.140.http: Flags [.], ack 14281, win 457, options [nop,nop,TS val 2900683542 ecr 1810216819,mptcp dss ack 3823547826], length 0
00:24:27.726807 ARP, Request who-has 130.104.228.140 tell csce-X101CH.local, length 28
00:24:27.747197 ARP, Request who-has 130.104.228.140 tell csce-X101CH.local, length 46
00:24:27.869926 IP 130.104.228.140.http > csce-X101CH.local.59660: Flags [P.], seq 14281:15709, ack 178, win 232, options [nop,nop,TS val 1810216974 ecr 2900683540,mptcp dss ack 4016585180 seq 3823547826 subseq 14281 len 1428 csum 0x44b9], length 1428: HTTP
00:24:27.870099 IP csce-X101CH.local.59660 > 130.104.228.140.http: Flags [.], ack 15709, win 480, options [nop,nop,TS val 2900683687 ecr 1810216974,mptcp dss ack 3823549254], length 0
00:24:27.870285 IP 130.104.228.140.http > csce-X101CH.local.59660: Flags [.], seq 15709:17137, ack 178, win 232, options [nop,nop,TS val 1810216974 ecr 2900683540,mptcp dss ack 4016585180 seq 3823549254 subseq 15709 len 1428 csum 0x2c44], length 1428: HTTP
00:24:27.870441 IP csce-X101CH.local.59660 > 130.104.228.140.http: Flags [.], ack 17137, win 502, options [nop,nop,TS val 2900683687 ecr 1810216974,mptcp dss ack 3823550682], length 0
00:24:27.870618 IP 130.104.228.140.http > csce-X101CH.local.59660: Flags [.], seq 17137:18565, ack 178, win 232, options [nop,nop,TS val 1810216975 ecr 2900683542,mptcp dss ack 4016585180 seq 3823550682 subseq 17137 len 1428 csum 0xd836], length 1428: HTTP
00:24:27.870772 IP csce-X101CH.local.59660 > 130.104.228.140.http: Flags [.], ack 18565, win 525, options [nop,nop,TS val 2900683688 ecr 1810216975,mptcp dss ack 3823552110], length 0
00:24:27.870939 IP 130.104.228.140.http > csce-X101CH.local.59660: Flags [.], seq 18565:19993, ack 178, win 232, options [nop,nop,TS val 1810216975 ecr 2900683542,mptcp dss ack 4016585180 seq 3823552110 subseq 18565 len 1428 csum 0x43ba], length 1428: HTTP
00:24:27.871086 IP csce-X101CH.local.59660 > 130.104.228.140.http: Flags [.], ack 19993, win 548, options [nop,nop,TS val 2900683688 ecr 1810216975,mptcp dss ack 3823553538], length 0
00:24:27.871233 IP 130.104.228.140.http > csce-X101CH.local.59660: Flags [.], seq 19993:21421, ack 178, win 232, options [nop,nop,TS val 1810216975 ecr 2900683542,mptcp dss ack 4016585180 seq 3823553538 subseq 19993 len 1428 csum 0x73de], length 1428: HTTP
00:24:27.871377 IP csce-X101CH.local.59660 > 130.104.228.140.http: Flags [.], ack 21421, win 571, options [nop,nop,TS val 2900683688 ecr 1810216975,mptcp dss ack 3823554966], length 0
00:24:27.871519 IP 130.104.228.140.http > csce-X101CH.local.59660: Flags [.], seq 21421:22849, ack 178, win 232, options [nop,nop,TS val 1810216975 ecr 2900683542,mptcp dss ack 4016585180 seq 3823554966 subseq 21421 len 1428 csum 0x67c7], length 1428: HTTP
00:24:27.871661 IP csce-X101CH.local.59660 > 130.104.228.140.http: Flags [.], ack 22849, win 594, options [nop,nop,TS val 2900683689 ecr 1810216975,mptcp dss ack 3823556394], length 0
00:24:27.873865 IP 130.104.228.140.http > csce-X101CH.local.59660: Flags [.], seq 22849:24277, ack 178, win 232, options [nop,nop,TS val 1810216975 ecr 2900683542,mptcp dss ack 4016585180 seq 3823556394 subseq 22849 len 1428 csum 0x1dc0], length 1428: HTTP
00:24:27.874033 IP csce-X101CH.local.59660 > 130.104.228.140.http: Flags [.], ack 24277, win 616, options [nop,nop,TS val 2900683691 ecr 1810216975,mptcp dss ack 3823557822], length 0
00:24:27.875959 IP 130.104.228.140.http > csce-X101CH.local.59660: Flags [.], seq 24277:25705, ack 178, win 232, options [nop,nop,TS val 1810216975 ecr 2900683542,mptcp dss ack 4016585180 seq 3823557822 subseq 24277 len 1428 csum 0x813b], length 1428: HTTP
00:24:27.876132 IP csce-X101CH.local.59660 > 130.104.228.140.http: Flags [.], ack 25705, win 639, options [nop,nop,TS val 2900683693 ecr 1810216975,mptcp dss ack 3823559250], length 0
00:24:27.876317 IP 130.104.228.140.http > csce-X101CH.local.59660: Flags [.], seq 25705:27133, ack 178, win 232, options [nop,nop,TS val 1810216975 ecr 2900683542,mptcp dss ack 4016585180 seq 3823559250 subseq 25705 len 1428 csum 0x9451], length 1428: HTTP
00:24:27.876470 IP csce-X101CH.local.59660 > 130.104.228.140.http: Flags [.], ack 27133, win 662, options [nop,nop,TS val 2900683693 ecr 1810216975,mptcp dss ack 3823560678], length 0
00:24:27.876717 IP 130.104.228.140.http > csce-X101CH.local.59660: Flags [P.], seq 27133:28561, ack 178, win 232, options [nop,nop,TS val 1810216975 ecr 2900683542,mptcp dss ack 4016585180 seq 3823560678 subseq 27133 len 1428 csum 0x9ce5], length 1428: HTTP
00:24:27.876872 IP csce-X101CH.local.59660 > 130.104.228.140.http: Flags [.], ack 28561, win 685, options [nop,nop,TS val 2900683694 ecr 1810216975,mptcp dss ack 3823562106], length 0
00:24:27.877024 IP 130.104.228.140.http > csce-X101CH.local.59660: Flags [.], seq 28561:29989, ack 178, win 232, options [nop,nop,TS val 1810216975 ecr 2900683542,mptcp dss ack 4016585180 seq 3823562106 subseq 28561 len 1428 csum 0x9be3], length 1428: HTTP
00:24:27.877178 IP csce-X101CH.local.59660 > 130.104.228.140.http: Flags [.], ack 29989, win 708, options [nop,nop,TS val 2900683694 ecr 1810216975,mptcp dss ack 3823563534], length 0
00:24:27.877323 IP 130.104.228.140.http > csce-X101CH.local.59660: Flags [.], seq 29989:31417, ack 178, win 232, options [nop,nop,TS val 1810216975 ecr 2900683542,mptcp dss ack 4016585180 seq 3823563534 subseq 29989 len 1428 csum 0x43ca], length 1428: HTTP
00:24:27.877474 IP csce-X101CH.local.59660 > 130.104.228.140.http: Flags [.], ack 31417, win 730, options [nop,nop,TS val 2900683694 ecr 1810216975,mptcp dss ack 3823564962], length 0
00:24:27.877630 IP 130.104.228.140.http > csce-X101CH.local.59660: Flags [.], seq 31417:32845, ack 178, win 232, options [nop,nop,TS val 1810216976 ecr 2900683542,mptcp dss ack 4016585180 seq 3823564962 subseq 31417 len 1428 csum 0xbf78], length 1428: HTTP
00:24:27.877783 IP csce-X101CH.local.59660 > 130.104.228.140.http: Flags [.], ack 32845, win 753, options [nop,nop,TS val 2900683695 ecr 1810216976,mptcp dss ack 3823566390], length 0
00:24:27.877935 IP 130.104.228.140.http > csce-X101CH.local.59660: Flags [.], seq 32845:34273, ack 178, win 232, options [nop,nop,TS val 1810216976 ecr 2900683542,mptcp dss ack 4016585180 seq 3823566390 subseq 32845 len 1428 csum 0xf17e], length 1428: HTTP
00:24:27.878078 IP csce-X101CH.local.59660 > 130.104.228.140.http: Flags [.], ack 34273, win 776, options [nop,nop,TS val 2900683695 ecr 1810216976,mptcp dss ack 3823567818], length 0
00:24:27.878218 IP 130.104.228.140.http > csce-X101CH.local.59660: Flags [.], seq 34273:35701, ack 178, win 232, options [nop,nop,TS val 1810216976 ecr 2900683542,mptcp dss ack 4016585180 seq 3823567818 subseq 34273 len 1428 csum 0x87c0], length 1428: HTTP
00:24:27.878365 IP csce-X101CH.local.59660 > 130.104.228.140.http: Flags [.], ack 35701, win 799, options [nop,nop,TS val 2900683695 ecr 1810216976,mptcp dss ack 3823569246], length 0
00:24:27.878520 IP 130.104.228.140.http > csce-X101CH.local.59660: Flags [.], seq 35701:37129, ack 178, win 232, options [nop,nop,TS val 1810216976 ecr 2900683542,mptcp dss ack 4016585180 seq 3823569246 subseq 35701 len 1428 csum 0xaed], length 1428: HTTP
00:24:27.878672 IP csce-X101CH.local.59660 > 130.104.228.140.http: Flags [.], ack 37129, win 822, options [nop,nop,TS val 2900683696 ecr 1810216976,mptcp dss ack 3823570674], length 0
00:24:27.878814 IP 130.104.228.140.http > csce-X101CH.local.59660: Flags [.], seq 37129:38557, ack 178, win 232, options [nop,nop,TS val 1810216976 ecr 2900683542,mptcp dss ack 4016585180 seq 3823570674 subseq 37129 len 1428 csum 0x15f1], length 1428: HTTP
00:24:27.878958 IP csce-X101CH.local.59660 > 130.104.228.140.http: Flags [.], ack 38557, win 845, options [nop,nop,TS val 2900683696 ecr 1810216976,mptcp dss ack 3823572102], length 0
00:24:27.879098 IP 130.104.228.140.http > csce-X101CH.local.59660: Flags [.], seq 38557:39985, ack 178, win 232, options [nop,nop,TS val 1810216976 ecr 2900683542,mptcp dss ack 4016585180 seq 3823572102 subseq 38557 len 1428 csum 0xa402], length 1428: HTTP
00:24:27.879249 IP csce-X101CH.local.59660 > 130.104.228.140.http: Flags [.], ack 39985, win 867, options [nop,nop,TS val 2900683696 ecr 1810216976,mptcp dss ack 3823573530], length 0
00:24:27.879408 IP 130.104.228.140.http > csce-X101CH.local.59660: Flags [.], seq 39985:41413, ack 178, win 232, options [nop,nop,TS val 1810216976 ecr 2900683542,mptcp dss ack 4016585180 seq 3823573530 subseq 39985 len 1428 csum 0xddbe], length 1428: HTTP
00:24:27.879556 IP csce-X101CH.local.59660 > 130.104.228.140.http: Flags [.], ack 41413, win 890, options [nop,nop,TS val 2900683697 ecr 1810216976,mptcp dss ack 3823574958], length 0
00:24:27.879702 IP 130.104.228.140.http > csce-X101CH.local.59660: Flags [.], seq 41413:42841, ack 178, win 232, options [nop,nop,TS val 1810216976 ecr 2900683542,mptcp dss ack 4016585180 seq 3823574958 subseq 41413 len 1428 csum 0x2bce], length 1428: HTTP
00:24:27.879852 IP csce-X101CH.local.59660 > 130.104.228.140.http: Flags [.], ack 42841, win 913, options [nop,nop,TS val 2900683697 ecr 1810216976,mptcp dss ack 3823576386], length 0
00:24:28.009869 IP 130.104.228.140.http > csce-X101CH.local.59660: Flags [.], seq 42841:44269, ack 178, win 232, options [nop,nop,TS val 1810217116 ecr 2900683687,mptcp dss ack 4016585180 seq 3823576386 subseq 42841 len 1428 csum 0x1bdc], length 1428: HTTP
00:24:28.010008 IP csce-X101CH.local.59660 > 130.104.228.140.http: Flags [.], ack 44269, win 936, options [nop,nop,TS val 2900683827 ecr 1810217116,mptcp dss ack 3823577814], length 0
00:24:28.010155 IP 130.104.228.140.http > csce-X101CH.local.59660: Flags [.], seq 44269:45697, ack 178, win 232, options [nop,nop,TS val 1810217116 ecr 2900683687,mptcp dss ack 4016585180 seq 3823577814 subseq 44269 len 1428 csum 0x70d5], length 1428: HTTP
00:24:28.010277 IP csce-X101CH.local.59660 > 130.104.228.140.http: Flags [.], ack 45697, win 959, options [nop,nop,TS val 2900683827 ecr 1810217116,mptcp dss ack 3823579242], length 0
00:24:28.010412 IP 130.104.228.140.http > csce-X101CH.local.59660: Flags [.], seq 45697:47125, ack 178, win 232, options [nop,nop,TS val 1810217117 ecr 2900683687,mptcp dss ack 4016585180 seq 3823579242 subseq 45697 len 1428 csum 0xb558], length 1428: HTTP
00:24:28.010540 IP csce-X101CH.local.59660 > 130.104.228.140.http: Flags [.], ack 47125, win 981, options [nop,nop,TS val 2900683828 ecr 1810217117,mptcp dss ack 3823580670], length 0
00:24:28.010893 IP 130.104.228.140.http > csce-X101CH.local.59660: Flags [.], seq 47125:48553, ack 178, win 232, options [nop,nop,TS val 1810217117 ecr 2900683687,mptcp dss ack 4016585180 seq 3823580670 subseq 47125 len 1428 csum 0xe09e], length 1428: HTTP
00:24:28.011132 IP csce-X101CH.local.59660 > 130.104.228.140.http: Flags [.], ack 48553, win 1004, options [nop,nop,TS val 2900683828 ecr 1810217117,mptcp dss ack 3823582098], length 0
00:24:28.018838 IP 130.104.228.140.http > csce-X101CH.local.59660: Flags [.], seq 48553:49981, ack 178, win 232, options [nop,nop,TS val 1810217124 ecr 2900683688,mptcp dss ack 4016585180 seq 3823582098 subseq 48553 len 1428 csum 0xa089], length 1428: HTTP
00:24:28.019025 IP csce-X101CH.local.59660 > 130.104.228.140.http: Flags [.], ack 49981, win 1027, options [nop,nop,TS val 2900683836 ecr 1810217124,mptcp dss ack 3823583526], length 0
00:24:28.019215 IP 130.104.228.140.http > csce-X101CH.local.59660: Flags [P.], seq 49981:51409, ack 178, win 232, options [nop,nop,TS val 1810217125 ecr 2900683688,mptcp dss ack 4016585180 seq 3823583526 subseq 49981 len 1428 csum 0x13d6], length 1428: HTTP
00:24:28.019371 IP csce-X101CH.local.59660 > 130.104.228.140.http: Flags [.], ack 51409, win 1050, options [nop,nop,TS val 2900683836 ecr 1810217125,mptcp dss ack 3823584954], length 0
00:24:28.019688 IP 130.104.228.140.http > csce-X101CH.local.59660: Flags [.], seq 51409:52837, ack 178, win 232, options [nop,nop,TS val 1810217125 ecr 2900683693,mptcp dss ack 4016585180 seq 3823584954 subseq 51409 len 1428 csum 0x2401], length 1428: HTTP
00:24:28.019885 IP csce-X101CH.local.59660 > 130.104.228.140.http: Flags [.], ack 52837, win 1073, options [nop,nop,TS val 2900683837 ecr 1810217125,mptcp dss ack 3823586382], length 0
00:24:28.020711 IP 130.104.228.140.http > csce-X101CH.local.59660: Flags [.], seq 52837:54265, ack 178, win 232, options [nop,nop,TS val 1810217125 ecr 2900683693,mptcp dss ack 4016585180 seq 3823586382 subseq 52837 len 1428 csum 0x7c96], length 1428: HTTP
00:24:28.020848 IP csce-X101CH.local.59660 > 130.104.228.140.http: Flags [.], ack 54265, win 1095, options [nop,nop,TS val 2900683838 ecr 1810217125,mptcp dss ack 3823587810], length 0
00:24:28.020970 IP 130.104.228.140.http > csce-X101CH.local.59660: Flags [.], seq 54265:55693, ack 178, win 232, options [nop,nop,TS val 1810217125 ecr 2900683693,mptcp dss ack 4016585180 seq 3823587810 subseq 54265 len 1428 csum 0xc59e], length 1428: HTTP
00:24:28.021054 IP csce-X101CH.local.59660 > 130.104.228.140.http: Flags [.], ack 55693, win 1118, options [nop,nop,TS val 2900683838 ecr 1810217125,mptcp dss ack 3823589238], length 0
00:24:28.021140 IP 130.104.228.140.http > csce-X101CH.local.59660: Flags [.], seq 55693:57121, ack 178, win 232, options [nop,nop,TS val 1810217125 ecr 2900683693,mptcp dss ack 4016585180 seq 3823589238 subseq 55693 len 1428 csum 0x14dd], length 1428: HTTP
00:24:28.021224 IP csce-X101CH.local.59660 > 130.104.228.140.http: Flags [.], ack 57121, win 1141, options [nop,nop,TS val 2900683838 ecr 1810217125,mptcp dss ack 3823590666], length 0
00:24:28.021300 IP 130.104.228.140.http > csce-X101CH.local.59660: Flags [.], seq 57121:58549, ack 178, win 232, options [nop,nop,TS val 1810217125 ecr 2900683693,mptcp dss ack 4016585180 seq 3823590666 subseq 57121 len 1428 csum 0xf106], length 1428: HTTP
00:24:28.021374 IP csce-X101CH.local.59660 > 130.104.228.140.http: Flags [.], ack 58549, win 1164, options [nop,nop,TS val 2900683838 ecr 1810217125,mptcp dss ack 3823592094], length 0
00:24:28.021934 IP 130.104.228.140.http > csce-X101CH.local.59660: Flags [.], seq 58549:59977, ack 178, win 232, options [nop,nop,TS val 1810217125 ecr 2900683693,mptcp dss ack 4016585180 seq 3823592094 subseq 58549 len 1428 csum 0x4759], length 1428: HTTP
00:24:28.022045 IP csce-X101CH.local.59660 > 130.104.228.140.http: Flags [.], ack 59977, win 1187, options [nop,nop,TS val 2900683839 ecr 1810217125,mptcp dss ack 3823593522], length 0
00:24:28.022701 IP 130.104.228.140.http > csce-X101CH.local.59660: Flags [.], seq 59977:61405, ack 178, win 232, options [nop,nop,TS val 1810217125 ecr 2900683693,mptcp dss ack 4016585180 seq 3823593522 subseq 59977 len 1428 csum 0x124], length 1428: HTTP
00:24:28.022870 IP csce-X101CH.local.59660 > 130.104.228.140.http: Flags [.], ack 61405, win 1210, options [nop,nop,TS val 2900683840 ecr 1810217125,mptcp dss ack 3823594950], length 0
00:24:28.023053 IP 130.104.228.140.http > csce-X101CH.local.59660: Flags [.], seq 61405:62833, ack 178, win 232, options [nop,nop,TS val 1810217125 ecr 2900683693,mptcp dss ack 4016585180 seq 3823594950 subseq 61405 len 1428 csum 0x14ab], length 1428: HTTP
00:24:28.023212 IP csce-X101CH.local.59660 > 130.104.228.140.http: Flags [.], ack 62833, win 1232, options [nop,nop,TS val 2900683840 ecr 1810217125,mptcp dss ack 3823596378], length 0
00:24:28.023560 IP 130.104.228.140.http > csce-X101CH.local.59660: Flags [.], seq 62833:64261, ack 178, win 232, options [nop,nop,TS val 1810217125 ecr 2900683693,mptcp dss ack 4016585180 seq 3823596378 subseq 62833 len 1428 csum 0x369e], length 1428: HTTP
00:24:28.023740 IP csce-X101CH.local.59660 > 130.104.228.140.http: Flags [.], ack 64261, win 1255, options [nop,nop,TS val 2900683841 ecr 1810217125,mptcp dss ack 3823597806], length 0
00:24:28.026817 IP 130.104.228.140.http > csce-X101CH.local.59660: Flags [.], seq 64261:65689, ack 178, win 232, options [nop,nop,TS val 1810217125 ecr 2900683693,mptcp dss ack 4016585180 seq 3823597806 subseq 64261 len 1428 csum 0x92ea], length 1428: HTTP
00:24:28.026954 IP csce-X101CH.local.59660 > 130.104.228.140.http: Flags [.], ack 65689, win 1278, options [nop,nop,TS val 2900683844 ecr 1810217125,mptcp dss ack 3823599234], length 0
00:24:28.028151 IP 130.104.228.140.http > csce-X101CH.local.59660: Flags [.], seq 65689:67117, ack 178, win 232, options [nop,nop,TS val 1810217126 ecr 2900683693,mptcp dss ack 4016585180 seq 3823599234 subseq 65689 len 1428 csum 0xb673], length 1428: HTTP
00:24:28.028290 IP csce-X101CH.local.59660 > 130.104.228.140.http: Flags [.], ack 67117, win 1301, options [nop,nop,TS val 2900683845 ecr 1810217126,mptcp dss ack 3823600662], length 0
00:24:28.028449 IP 130.104.228.140.http > csce-X101CH.local.59660: Flags [.], seq 67117:68545, ack 178, win 232, options [nop,nop,TS val 1810217126 ecr 2900683693,mptcp dss ack 4016585180 seq 3823600662 subseq 67117 len 1428 csum 0x1636], length 1428: HTTP
00:24:28.028661 IP csce-X101CH.local.59660 > 130.104.228.140.http: Flags [.], ack 68545, win 1324, options [nop,nop,TS val 2900683846 ecr 1810217126,mptcp dss ack 3823602090], length 0
00:24:28.028826 IP 130.104.228.140.http > csce-X101CH.local.59660: Flags [.], seq 68545:69973, ack 178, win 232, options [nop,nop,TS val 1810217133 ecr 2900683694,mptcp dss ack 4016585180 seq 3823602090 subseq 68545 len 1428 csum 0x20dd], length 1428: HTTP
00:24:28.028926 IP csce-X101CH.local.59660 > 130.104.228.140.http: Flags [.], ack 69973, win 1346, options [nop,nop,TS val 2900683846 ecr 1810217133,mptcp dss ack 3823603518], length 0
00:24:28.029023 IP 130.104.228.140.http > csce-X101CH.local.59660: Flags [.], seq 69973:71401, ack 178, win 232, options [nop,nop,TS val 1810217133 ecr 2900683694,mptcp dss ack 4016585180 seq 3823603518 subseq 69973 len 1428 csum 0x9cfb], length 1428: HTTP
00:24:28.029138 IP csce-X101CH.local.59660 > 130.104.228.140.http: Flags [.], ack 71401, win 1352, options [nop,nop,TS val 2900683846 ecr 1810217133,mptcp dss ack 3823604946], length 0
00:24:28.029267 IP 130.104.228.140.http > csce-X101CH.local.59660: Flags [.], seq 71401:72829, ack 178, win 232, options [nop,nop,TS val 1810217133 ecr 2900683697,mptcp dss ack 4016585180 seq 3823604946 subseq 71401 len 1428 csum 0x32dc], length 1428: HTTP
00:24:28.029384 IP csce-X101CH.local.59660 > 130.104.228.140.http: Flags [.], ack 72829, win 1352, options [nop,nop,TS val 2900683846 ecr 1810217133,mptcp dss ack 3823606374], length 0
00:24:28.029494 IP 130.104.228.140.http > csce-X101CH.local.59660: Flags [.], seq 72829:74257, ack 178, win 232, options [nop,nop,TS val 1810217133 ecr 2900683697,mptcp dss ack 4016585180 seq 3823606374 subseq 72829 len 1428 csum 0xf8ac], length 1428: HTTP
00:24:28.029613 IP csce-X101CH.local.59660 > 130.104.228.140.http: Flags [.], ack 74257, win 1352, options [nop,nop,TS val 2900683847 ecr 1810217133,mptcp dss ack 3823607802], length 0
00:24:28.029724 IP 130.104.228.140.http > csce-X101CH.local.59660: Flags [.], seq 74257:75685, ack 178, win 232, options [nop,nop,TS val 1810217133 ecr 2900683697,mptcp dss ack 4016585180 seq 3823607802 subseq 74257 len 1428 csum 0x3fa1], length 1428: HTTP
00:24:28.029842 IP csce-X101CH.local.59660 > 130.104.228.140.http: Flags [.], ack 75685, win 1352, options [nop,nop,TS val 2900683847 ecr 1810217133,mptcp dss ack 3823609230], length 0
00:24:28.029974 IP 130.104.228.140.http > csce-X101CH.local.59660: Flags [P.], seq 75685:77113, ack 178, win 232, options [nop,nop,TS val 1810217133 ecr 2900683697,mptcp dss ack 4016585180 seq 3823609230 subseq 75685 len 1428 csum 0x2cb0], length 1428: HTTP
00:24:28.030094 IP csce-X101CH.local.59660 > 130.104.228.140.http: Flags [.], ack 77113, win 1352, options [nop,nop,TS val 2900683847 ecr 1810217133,mptcp dss ack 3823610658], length 0
00:24:28.030206 IP 130.104.228.140.http > csce-X101CH.local.59660: Flags [.], seq 77113:78541, ack 178, win 232, options [nop,nop,TS val 1810217133 ecr 2900683697,mptcp dss ack 4016585180 seq 3823610658 subseq 77113 len 1428 csum 0x6c0a], length 1428: HTTP
00:24:28.030324 IP csce-X101CH.local.59660 > 130.104.228.140.http: Flags [.], ack 78541, win 1352, options [nop,nop,TS val 2900683847 ecr 1810217133,mptcp dss ack 3823612086], length 0
00:24:28.030677 IP 130.104.228.140.http > csce-X101CH.local.59660: Flags [.], seq 78541:79969, ack 178, win 232, options [nop,nop,TS val 1810217133 ecr 2900683697,mptcp dss ack 4016585180 seq 3823612086 subseq 78541 len 1428 csum 0x30db], length 1428: HTTP
00:24:28.030770 IP csce-X101CH.local.59660 > 130.104.228.140.http: Flags [.], ack 79969, win 1352, options [nop,nop,TS val 2900683848 ecr 1810217133,mptcp dss ack 3823613514], length 0
00:24:28.032148 IP 130.104.228.140.http > csce-X101CH.local.59660: Flags [.], seq 79969:81397, ack 178, win 232, options [nop,nop,TS val 1810217134 ecr 2900683697,mptcp dss ack 4016585180 seq 3823613514 subseq 79969 len 1428 csum 0x5e81], length 1428: HTTP
00:24:28.032286 IP csce-X101CH.local.59660 > 130.104.228.140.http: Flags [.], ack 81397, win 1352, options [nop,nop,TS val 2900683849 ecr 1810217134,mptcp dss ack 3823614942], length 0
00:24:28.032430 IP 130.104.228.140.http > csce-X101CH.local.59660: Flags [.], seq 81397:82825, ack 178, win 232, options [nop,nop,TS val 1810217134 ecr 2900683697,mptcp dss ack 4016585180 seq 3823614942 subseq 81397 len 1428 csum 0xea83], length 1428: HTTP
00:24:28.032553 IP csce-X101CH.local.59660 > 130.104.228.140.http: Flags [.], ack 82825, win 1352, options [nop,nop,TS val 2900683850 ecr 1810217134,mptcp dss ack 3823616370], length 0
00:24:28.032695 IP 130.104.228.140.http > csce-X101CH.local.59660: Flags [.], seq 82825:84253, ack 178, win 232, options [nop,nop,TS val 1810217134 ecr 2900683697,mptcp dss ack 4016585180 seq 3823616370 subseq 82825 len 1428 csum 0x1306], length 1428: HTTP
00:24:28.032875 IP csce-X101CH.local.59660 > 130.104.228.140.http: Flags [.], ack 84253, win 1352, options [nop,nop,TS val 2900683850 ecr 1810217134,mptcp dss ack 3823617798], length 0
00:24:28.032922 IP 130.104.228.140.http > csce-X101CH.local.59660: Flags [.], seq 84253:85681, ack 178, win 232, options [nop,nop,TS val 1810217134 ecr 2900683697,mptcp dss ack 4016585180 seq 3823617798 subseq 84253 len 1428 csum 0xfbd2], length 1428: HTTP
00:24:28.033051 IP csce-X101CH.local.59660 > 130.104.228.140.http: Flags [.], ack 85681, win 1352, options [nop,nop,TS val 2900683850 ecr 1810217134,mptcp dss ack 3823619226], length 0
00:24:28.033459 IP 130.104.228.140.http > csce-X101CH.local.59660: Flags [.], seq 85681:87109, ack 178, win 232, options [nop,nop,TS val 1810217134 ecr 2900683697,mptcp dss ack 4016585180 seq 3823619226 subseq 85681 len 1428 csum 0x5de5], length 1428: HTTP
00:24:28.035132 IP 130.104.228.140.http > csce-X101CH.local.59660: Flags [.], seq 87109:88537, ack 178, win 232, options [nop,nop,TS val 1810217134 ecr 2900683697,mptcp dss ack 4016585180 seq 3823620654 subseq 87109 len 1428 csum 0x5ae5], length 1428: HTTP
00:24:28.035270 IP csce-X101CH.local.59660 > 130.104.228.140.http: Flags [.], ack 88537, win 1352, options [nop,nop,TS val 2900683852 ecr 1810217134,mptcp dss ack 3823622082], length 0
00:24:28.035415 IP 130.104.228.140.http > csce-X101CH.local.59660: Flags [.], seq 88537:89965, ack 178, win 232, options [nop,nop,TS val 1810217134 ecr 2900683697,mptcp dss ack 4016585180 seq 3823622082 subseq 88537 len 1428 csum 0x4546], length 1428: HTTP
00:24:28.036515 IP 130.104.228.140.http > csce-X101CH.local.59660: Flags [.], seq 89965:91393, ack 178, win 232, options [nop,nop,TS val 1810217134 ecr 2900683697,mptcp dss ack 4016585180 seq 3823623510 subseq 89965 len 1428 csum 0x8687], length 1428: HTTP
00:24:28.036630 IP csce-X101CH.local.59660 > 130.104.228.140.http: Flags [.], ack 91393, win 1352, options [nop,nop,TS val 2900683854 ecr 1810217134,mptcp dss ack 3823624938], length 0
00:24:28.037890 IP 130.104.228.140.http > csce-X101CH.local.59660: Flags [.], seq 91393:92821, ack 178, win 232, options [nop,nop,TS val 1810217134 ecr 2900683697,mptcp dss ack 4016585180 seq 3823624938 subseq 91393 len 1428 csum 0x1155], length 1428: HTTP
00:24:28.038592 IP 130.104.228.140.http > csce-X101CH.local.59660: Flags [.], seq 92821:94249, ack 178, win 232, options [nop,nop,TS val 1810217134 ecr 2900683697,mptcp dss ack 4016585180 seq 3823626366 subseq 92821 len 1428 csum 0xc089], length 1428: HTTP
00:24:28.038694 IP csce-X101CH.local.59660 > 130.104.228.140.http: Flags [.], ack 94249, win 1352, options [nop,nop,TS val 2900683856 ecr 1810217134,mptcp dss ack 3823627794], length 0
00:24:28.038800 IP 130.104.228.140.http > csce-X101CH.local.59660: Flags [.], seq 94249:95677, ack 178, win 232, options [nop,nop,TS val 1810217134 ecr 2900683697,mptcp dss ack 4016585180 seq 3823627794 subseq 94249 len 1428 csum 0x9a94], length 1428: HTTP
00:24:28.039144 IP 130.104.228.140.http > csce-X101CH.local.59660: Flags [.], seq 95677:97105, ack 178, win 232, options [nop,nop,TS val 1810217134 ecr 2900683697,mptcp dss ack 4016585180 seq 3823629222 subseq 95677 len 1428 csum 0x2c17], length 1428: HTTP
00:24:28.039240 IP csce-X101CH.local.59660 > 130.104.228.140.http: Flags [.], ack 97105, win 1352, options [nop,nop,TS val 2900683856 ecr 1810217134,mptcp dss ack 3823630650], length 0
00:24:28.039847 IP 130.104.228.140.http > csce-X101CH.local.59660: Flags [.], seq 97105:98533, ack 178, win 232, options [nop,nop,TS val 1810217135 ecr 2900683697,mptcp dss ack 4016585180 seq 3823630650 subseq 97105 len 1428 csum 0xd0bf], length 1428: HTTP
00:24:28.040478 IP 130.104.228.140.http > csce-X101CH.local.59660: Flags [.], seq 98533:99961, ack 178, win 232, options [nop,nop,TS val 1810217135 ecr 2900683697,mptcp dss ack 4016585180 seq 3823632078 subseq 98533 len 1428 csum 0x2433], length 1428: HTTP
00:24:28.040557 IP csce-X101CH.local.59660 > 130.104.228.140.http: Flags [.], ack 99961, win 1352, options [nop,nop,TS val 2900683858 ecr 1810217135,mptcp dss ack 3823633506], length 0
00:24:28.150834 IP 130.104.228.140.http > csce-X101CH.local.59660: Flags [.], seq 99961:101389, ack 178, win 232, options [nop,nop,TS val 1810217256 ecr 2900683827,mptcp dss ack 4016585180 seq 3823633506 subseq 99961 len 1428 csum 0x52ed], length 1428: HTTP
00:24:28.151004 IP 130.104.228.140.http > csce-X101CH.local.59660: Flags [.], seq 101389:102817, ack 178, win 232, options [nop,nop,TS val 1810217256 ecr 2900683827,mptcp dss ack 4016585180 seq 3823634934 subseq 101389 len 1428 csum 0xf49], length 1428: HTTP
00:24:28.151132 IP csce-X101CH.local.59660 > 130.104.228.140.http: Flags [.], ack 102817, win 1352, options [nop,nop,TS val 2900683968 ecr 1810217256,mptcp dss ack 3823636362], length 0
00:24:28.151299 IP 130.104.228.140.http > csce-X101CH.local.59660: Flags [P.], seq 102817:104245, ack 178, win 232, options [nop,nop,TS val 1810217257 ecr 2900683828,mptcp dss ack 4016585180 seq 3823636362 subseq 102817 len 1428 csum 0xf482], length 1428: HTTP
00:24:28.153143 IP 130.104.228.140.http > csce-X101CH.local.59660: Flags [.], seq 104245:105673, ack 178, win 232, options [nop,nop,TS val 1810217257 ecr 2900683828,mptcp dss ack 4016585180 seq 3823637790 subseq 104245 len 1428 csum 0x5dbf], length 1428: HTTP
00:24:28.153270 IP csce-X101CH.local.59660 > 130.104.228.140.http: Flags [.], ack 105673, win 1352, options [nop,nop,TS val 2900683970 ecr 1810217257,mptcp dss ack 3823639218], length 0
00:24:28.153437 IP 130.104.228.140.http > csce-X101CH.local.59660: Flags [.], seq 105673:107101, ack 178, win 232, options [nop,nop,TS val 1810217257 ecr 2900683828,mptcp dss ack 4016585180 seq 3823639218 subseq 105673 len 1428 csum 0x927a], length 1428: HTTP
00:24:28.156993 IP 130.104.228.140.http > csce-X101CH.local.59660: Flags [.], seq 107101:108529, ack 178, win 232, options [nop,nop,TS val 1810217257 ecr 2900683828,mptcp dss ack 4016585180 seq 3823640646 subseq 107101 len 1428 csum 0x44d], length 1428: HTTP
00:24:28.157134 IP csce-X101CH.local.59660 > 130.104.228.140.http: Flags [.], ack 108529, win 1352, options [nop,nop,TS val 2900683974 ecr 1810217257,mptcp dss ack 3823642074], length 0
00:24:28.157304 IP 130.104.228.140.http > csce-X101CH.local.59660: Flags [.], seq 108529:109957, ack 178, win 232, options [nop,nop,TS val 1810217257 ecr 2900683828,mptcp dss ack 4016585180 seq 3823642074 subseq 108529 len 1428 csum 0x2759], length 1428: HTTP
00:24:28.157464 IP 130.104.228.140.http > csce-X101CH.local.59660: Flags [.], seq 109957:111385, ack 178, win 232, options [nop,nop,TS val 1810217257 ecr 2900683828,mptcp dss ack 4016585180 seq 3823643502 subseq 109957 len 1428 csum 0x7ae3], length 1428: HTTP
00:24:28.157594 IP csce-X101CH.local.59660 > 130.104.228.140.http: Flags [.], ack 111385, win 1352, options [nop,nop,TS val 2900683975 ecr 1810217257,mptcp dss ack 3823644930], length 0
00:24:28.174087 IP 130.104.228.140.http > csce-X101CH.local.59660: Flags [.], seq 111385:112813, ack 178, win 232, options [nop,nop,TS val 1810217280 ecr 2900683836,mptcp dss ack 4016585180 seq 3823644930 subseq 111385 len 1428 csum 0x476d], length 1428: HTTP
00:24:28.174260 IP 130.104.228.140.http > csce-X101CH.local.59660: Flags [.], seq 112813:114241, ack 178, win 232, options [nop,nop,TS val 1810217280 ecr 2900683836,mptcp dss ack 4016585180 seq 3823646358 subseq 112813 len 1428 csum 0x3608], length 1428: HTTP
00:24:28.174390 IP csce-X101CH.local.59660 > 130.104.228.140.http: Flags [.], ack 114241, win 1375, options [nop,nop,TS val 2900683991 ecr 1810217280,mptcp dss ack 3823647786], length 0
00:24:28.174641 IP 130.104.228.140.http > csce-X101CH.local.59660: Flags [.], seq 114241:115669, ack 178, win 232, options [nop,nop,TS val 1810217280 ecr 2900683838,mptcp dss ack 4016585180 seq 3823647786 subseq 114241 len 1428 csum 0xab39], length 1428: HTTP
00:24:28.174799 IP csce-X101CH.local.59660 > 130.104.228.140.http: Flags [.], ack 115669, win 1397, options [nop,nop,TS val 2900683992 ecr 1810217280,mptcp dss ack 3823649214], length 0
00:24:28.175037 IP 130.104.228.140.http > csce-X101CH.local.59660: Flags [.], seq 115669:117097, ack 178, win 232, options [nop,nop,TS val 1810217280 ecr 2900683838,mptcp dss ack 4016585180 seq 3823649214 subseq 115669 len 1428 csum 0x1204], length 1428: HTTP
00:24:28.175168 IP csce-X101CH.local.59660 > 130.104.228.140.http: Flags [.], ack 117097, win 1420, options [nop,nop,TS val 2900683992 ecr 1810217280,mptcp dss ack 3823650642], length 0
00:24:28.175372 IP 130.104.228.140.http > csce-X101CH.local.59660: Flags [.], seq 117097:118525, ack 178, win 232, options [nop,nop,TS val 1810217280 ecr 2900683838,mptcp dss ack 4016585180 seq 3823650642 subseq 117097 len 1428 csum 0x6546], length 1428: HTTP
00:24:28.175477 IP csce-X101CH.local.59660 > 130.104.228.140.http: Flags [.], ack 118525, win 1422, options [nop,nop,TS val 2900683993 ecr 1810217280,mptcp dss ack 3823652070], length 0
00:24:28.177445 IP 130.104.228.140.http > csce-X101CH.local.59660: Flags [.], seq 118525:119953, ack 178, win 232, options [nop,nop,TS val 1810217280 ecr 2900683838,mptcp dss ack 4016585180 seq 3823652070 subseq 118525 len 1428 csum 0x7a63], length 1428: HTTP
00:24:28.177615 IP 130.104.228.140.http > csce-X101CH.local.59660: Flags [.], seq 119953:121381, ack 178, win 232, options [nop,nop,TS val 1810217281 ecr 2900683838,mptcp dss ack 4016585180 seq 3823653498 subseq 119953 len 1428 csum 0xda24], length 1428: HTTP
00:24:28.177742 IP csce-X101CH.local.59660 > 130.104.228.140.http: Flags [.], ack 121381, win 1422, options [nop,nop,TS val 2900683995 ecr 1810217280,mptcp dss ack 3823654926], length 0
00:24:28.180596 IP 130.104.228.140.http > csce-X101CH.local.59660: Flags [.], seq 121381:122809, ack 178, win 232, options [nop,nop,TS val 1810217281 ecr 2900683838,mptcp dss ack 4016585180 seq 3823654926 subseq 121381 len 1428 csum 0x780b], length 1428: HTTP
00:24:28.181745 IP 130.104.228.140.http > csce-X101CH.local.59660: Flags [.], seq 122809:124237, ack 178, win 232, options [nop,nop,TS val 1810217281 ecr 2900683838,mptcp dss ack 4016585180 seq 3823656354 subseq 122809 len 1428 csum 0xa0da], length 1428: HTTP
00:24:28.181890 IP csce-X101CH.local.59660 > 130.104.228.140.http: Flags [.], ack 124237, win 1422, options [nop,nop,TS val 2900683999 ecr 1810217281,mptcp dss ack 3823657782], length 0
00:24:28.182046 IP 130.104.228.140.http > csce-X101CH.local.59660: Flags [.], seq 124237:125665, ack 178, win 232, options [nop,nop,TS val 1810217281 ecr 2900683838,mptcp dss ack 4016585180 seq 3823657782 subseq 124237 len 1428 csum 0x1d2f], length 1428: HTTP
00:24:28.182200 IP 130.104.228.140.http > csce-X101CH.local.59660: Flags [.], seq 125665:127093, ack 178, win 232, options [nop,nop,TS val 1810217281 ecr 2900683838,mptcp dss ack 4016585180 seq 3823659210 subseq 125665 len 1428 csum 0x2750], length 1428: HTTP
00:24:28.182356 IP 130.104.228.140.http > csce-X101CH.local.59660: Flags [.], seq 127093:128521, ack 178, win 232, options [nop,nop,TS val 1810217281 ecr 2900683838,mptcp dss ack 4016585180 seq 3823660638 subseq 127093 len 1428 csum 0x9640], length 1428: HTTP
00:24:28.182356 IP csce-X101CH.local.59660 > 130.104.228.140.http: Flags [.], ack 127093, win 1432, options [nop,nop,TS val 2900683999 ecr 1810217281,mptcp dss ack 3823660638], length 0
00:24:28.182481 IP 130.104.228.140.http > csce-X101CH.local.59660: Flags [.], seq 128521:129949, ack 178, win 232, options [nop,nop,TS val 1810217281 ecr 2900683838,mptcp dss ack 4016585180 seq 3823662066 subseq 128521 len 1428 csum 0xed9a], length 1428: HTTP
00:24:28.182631 IP 130.104.228.140.http > csce-X101CH.local.59660: Flags [.], seq 129949:131377, ack 178, win 232, options [nop,nop,TS val 1810217281 ecr 2900683838,mptcp dss ack 4016585180 seq 3823663494 subseq 129949 len 1428 csum 0x2125], length 1428: HTTP
00:24:28.182733 IP csce-X101CH.local.59660 > 130.104.228.140.http: Flags [.], ack 129949, win 1432, options [nop,nop,TS val 2900684000 ecr 1810217281,mptcp dss ack 3823663494], length 0
00:24:28.183304 IP 130.104.228.140.http > csce-X101CH.local.59660: Flags [.], seq 131377:132805, ack 178, win 232, options [nop,nop,TS val 1810217290 ecr 2900683839,mptcp dss ack 4016585180 seq 3823664922 subseq 131377 len 1428 csum 0xe8a7], length 1428: HTTP
